
############## carina - 07/24/20 18:10:17 EDT -0400 ##############

2020-07-24 18:10:21 3 packets transmitted, 3 received, 0% packet loss, time 4004ms
2020-07-24 18:10:21 rtt min/avg/max/mdev = 47.923/53.219/56.706/3.811 ms

############## carina - 07/24/20 18:11:06 EDT -0400 ##############

2020-07-24 18:11:10 3 packets transmitted, 3 received, 0% packet loss, time 4005ms
2020-07-24 18:11:10 rtt min/avg/max/mdev = 47.909/57.903/64.487/7.184 ms

############## carina - 07/24/20 23:54:45 EDT -0400 ##############

2020-07-25 05:43:55 350 packets transmitted, 350 received, 0% packet loss, time 20949472ms
2020-07-25 05:43:55 rtt min/avg/max/mdev = 34.114/62.052/241.606/25.691 ms

############## carina - 07/25/20 05:54:45 EDT -0400 ##############

2020-07-25 11:43:54 350 packets transmitted, 350 received, 0% packet loss, time 20949077ms
2020-07-25 11:43:54 rtt min/avg/max/mdev = 36.054/55.693/383.164/22.458 ms

############## carina - 07/25/20 11:54:45 EDT -0400 ##############

2020-07-25 17:44:56 350 packets transmitted, 346 received, 1% packet loss, time 20950679ms
2020-07-25 17:44:56 rtt min/avg/max/mdev = 36.496/163.224/1772.434/235.831 ms

############## carina - 07/25/20 17:54:45 EDT -0400 ##############

2020-07-25 22:43:54 350 packets transmitted, 350 received, 0% packet loss, time 20948979ms
2020-07-25 22:43:54 rtt min/avg/max/mdev = 30.365/64.788/198.463/25.639 ms

############## carina - 07/25/20 23:54:44 EST -0500 ##############

2020-07-26 05:43:54 350 packets transmitted, 350 received, 0% packet loss, time 20950065ms
2020-07-26 05:43:54 rtt min/avg/max/mdev = 32.961/45.326/80.103/6.352 ms

############## carina - 07/26/20 11:54:47 EST -0500 ##############

2020-07-26 17:45:00 350 packets transmitted, 343 received, 2% packet loss, time 20953532ms
2020-07-26 17:45:00 rtt min/avg/max/mdev = 35.755/129.156/2238.238/260.388 ms

############## carina - 07/26/20 17:54:46 EST -0500 ##############

2020-07-26 23:43:56 350 packets transmitted, 350 received, 0% packet loss, time 20949786ms
2020-07-26 23:43:56 rtt min/avg/max/mdev = 32.022/68.863/5155.546/274.873 ms

############## carina - 07/26/20 23:54:45 EST -0500 ##############

2020-07-27 05:43:55 350 packets transmitted, 350 received, 0% packet loss, time 20949956ms
2020-07-27 05:43:55 rtt min/avg/max/mdev = 30.944/43.953/128.618/7.306 ms

############## carina - 07/27/20 05:54:44 EST -0500 ##############

2020-07-27 11:43:53 350 packets transmitted, 350 received, 0% packet loss, time 20948948ms
2020-07-27 11:43:53 rtt min/avg/max/mdev = 48.576/71.082/1306.374/69.666 ms

############## carina - 07/27/20 11:54:46 EST -0500 ##############

2020-07-27 17:43:55 350 packets transmitted, 350 received, 0% packet loss, time 20949243ms
2020-07-27 17:43:55 rtt min/avg/max/mdev = 32.862/136.362/1599.489/207.936 ms

############## carina - 07/27/20 17:54:44 EST -0500 ##############

2020-07-27 23:43:53 350 packets transmitted, 350 received, 0% packet loss, time 20949103ms
2020-07-27 23:43:53 rtt min/avg/max/mdev = 35.722/51.974/134.592/15.681 ms

############## carina - 07/27/20 23:54:43 EST -0500 ##############

2020-07-28 05:43:53 350 packets transmitted, 350 received, 0% packet loss, time 20949232ms
2020-07-28 05:43:53 rtt min/avg/max/mdev = 34.125/45.171/85.633/6.407 ms

############## carina - 07/28/20 05:54:44 EST -0500 ##############

2020-07-28 11:43:53 350 packets transmitted, 350 received, 0% packet loss, time 20948642ms
2020-07-28 11:43:53 rtt min/avg/max/mdev = 31.792/49.158/115.902/11.033 ms

############## carina - 07/28/20 11:54:46 EST -0500 ##############

2020-07-28 17:43:57 350 packets transmitted, 350 received, 0% packet loss, time 20950505ms
2020-07-28 17:43:57 rtt min/avg/max/mdev = 37.190/55.946/610.227/34.638 ms

############## carina - 07/28/20 17:54:46 EST -0500 ##############

2020-07-28 23:43:54 350 packets transmitted, 350 received, 0% packet loss, time 20948635ms
2020-07-28 23:43:54 rtt min/avg/max/mdev = 41.625/65.422/212.724/13.839 ms

############## carina - 07/28/20 23:54:43 EST -0500 ##############

2020-07-29 05:43:52 350 packets transmitted, 350 received, 0% packet loss, time 20948317ms
2020-07-29 05:43:52 rtt min/avg/max/mdev = 31.296/45.674/75.282/6.977 ms

############## carina - 07/29/20 05:54:45 EST -0500 ##############

2020-07-29 11:44:54 350 packets transmitted, 349 received, 0% packet loss, time 20949281ms
2020-07-29 11:44:54 rtt min/avg/max/mdev = 31.024/49.774/100.369/10.076 ms

############## carina - 07/29/20 11:54:45 EST -0500 ##############

2020-07-29 17:44:53 350 packets transmitted, 348 received, 0% packet loss, time 20948674ms
2020-07-29 17:44:53 rtt min/avg/max/mdev = 46.321/79.273/1442.995/80.276 ms

############## carina - 07/29/20 17:54:51 EST -0500 ##############

2020-07-29 23:45:01 350 packets transmitted, 349 received, 0% packet loss, time 20949355ms
2020-07-29 23:45:01 rtt min/avg/max/mdev = 34.943/58.002/2679.751/141.298 ms

############## carina - 07/29/20 23:54:47 EST -0500 ##############

2020-07-30 05:43:56 350 packets transmitted, 350 received, 0% packet loss, time 20949259ms
2020-07-30 05:43:56 rtt min/avg/max/mdev = 30.621/50.286/1194.224/61.988 ms

############## carina - 07/30/20 05:54:55 EST -0500 ##############

2020-07-30 11:44:03 350 packets transmitted, 350 received, 0% packet loss, time 20948444ms
2020-07-30 11:44:03 rtt min/avg/max/mdev = 31.044/53.259/1743.346/91.152 ms

############## carina - 07/30/20 11:54:44 EST -0500 ##############

2020-07-30 17:43:54 350 packets transmitted, 350 received, 0% packet loss, time 20949168ms
2020-07-30 17:43:54 rtt min/avg/max/mdev = 34.935/53.671/576.702/30.215 ms

############## carina - 07/30/20 17:54:45 EST -0500 ##############

2020-07-30 23:44:54 350 packets transmitted, 349 received, 0% packet loss, time 20948851ms
2020-07-30 23:44:54 rtt min/avg/max/mdev = 49.005/120.565/1697.102/183.644 ms

############## carina - 07/30/20 23:54:44 EST -0500 ##############

2020-07-31 05:44:53 350 packets transmitted, 349 received, 0% packet loss, time 20949232ms
2020-07-31 05:44:53 rtt min/avg/max/mdev = 39.531/65.258/227.637/19.494 ms

############## carina - 07/31/20 13:20:10 EST -0500 ##############

############## carina - 07/31/20 13:20:10 EST -0500 ##############


############## carina - 07/31/20 17:54:43 EST -0500 ##############

2020-07-31 23:43:52 350 packets transmitted, 350 received, 0% packet loss, time 20949209ms
2020-07-31 23:43:52 rtt min/avg/max/mdev = 42.626/77.047/393.662/28.181 ms

############## carina - 07/31/20 23:54:44 EST -0500 ##############

2020-08-01 05:45:49 350 packets transmitted, 350 received, 0% packet loss, time 21064664ms
2020-08-01 05:45:49 rtt min/avg/max/mdev = 31.082/52.261/196.085/22.681 ms

############## carina - 08/01/20 05:54:50 EST -0500 ##############

2020-08-01 11:46:51 350 packets transmitted, 339 received, 3% packet loss, time 20950211ms
2020-08-01 11:46:51 rtt min/avg/max/mdev = 38.367/551.354/85115.952/4817.422 ms, pipe 2

############## carina - 08/01/20 11:55:14 EST -0500 ##############

2020-08-01 17:45:41 350 packets transmitted, 315 received, 10% packet loss, time 20966382ms
2020-08-01 17:45:41 rtt min/avg/max/mdev = 55.568/445.641/5162.704/616.810 ms

############## carina - 08/01/20 17:54:43 EST -0500 ##############

2020-08-01 23:44:53 350 packets transmitted, 348 received, 0% packet loss, time 20949502ms
2020-08-01 23:44:53 rtt min/avg/max/mdev = 36.183/78.109/1237.226/119.676 ms

############## carina - 08/01/20 23:54:43 EST -0500 ##############

2020-08-02 05:43:53 350 packets transmitted, 350 received, 0% packet loss, time 20949060ms
2020-08-02 05:43:53 rtt min/avg/max/mdev = 32.148/48.846/141.189/8.591 ms

############## carina - 08/02/20 05:54:43 EST -0500 ##############

2020-08-02 11:44:59 350 packets transmitted, 342 received, 2% packet loss, time 20955796ms
2020-08-02 11:44:59 rtt min/avg/max/mdev = 37.753/160.770/4919.778/345.578 ms

############## carina - 08/02/20 11:55:10 EST -0500 ##############

2020-08-02 17:44:20 350 packets transmitted, 350 received, 0% packet loss, time 20949605ms
2020-08-02 17:44:20 rtt min/avg/max/mdev = 32.460/55.045/138.655/16.101 ms

############## carina - 08/02/20 17:54:45 EST -0500 ##############

2020-08-02 23:43:54 350 packets transmitted, 350 received, 0% packet loss, time 20948867ms
2020-08-02 23:43:54 rtt min/avg/max/mdev = 33.248/53.159/141.726/15.133 ms

############## carina - 08/02/20 23:54:44 EST -0500 ##############

2020-08-03 05:43:53 350 packets transmitted, 350 received, 0% packet loss, time 20948672ms
2020-08-03 05:43:53 rtt min/avg/max/mdev = 41.065/61.019/145.740/16.375 ms

############## carina - 08/03/20 05:54:45 EST -0500 ##############

2020-08-03 11:44:53 350 packets transmitted, 346 received, 1% packet loss, time 20948186ms
2020-08-03 11:44:53 rtt min/avg/max/mdev = 41.021/95.708/1464.302/118.513 ms

############## carina - 08/03/20 11:55:08 EST -0500 ##############

2020-08-03 17:45:21 350 packets transmitted, 347 received, 0% packet loss, time 20952215ms
2020-08-03 17:45:21 rtt min/avg/max/mdev = 35.345/71.087/696.668/53.129 ms

############## carina - 08/03/20 23:54:45 EST -0500 ##############

2020-08-04 05:43:55 350 packets transmitted, 350 received, 0% packet loss, time 20949288ms
2020-08-04 05:43:55 rtt min/avg/max/mdev = 38.663/54.191/453.049/22.976 ms

############## carina - 08/04/20 11:55:09 EST -0500 ##############

2020-08-04 17:44:18 350 packets transmitted, 350 received, 0% packet loss, time 20948736ms
2020-08-04 17:44:18 rtt min/avg/max/mdev = 38.676/56.959/156.432/15.359 ms

############## carina - 08/04/20 23:54:46 EST -0500 ##############

2020-08-05 05:43:55 350 packets transmitted, 350 received, 0% packet loss, time 20949282ms
2020-08-05 05:43:55 rtt min/avg/max/mdev = 31.703/44.133/118.347/7.597 ms

############## carina - 08/05/20 11:55:08 EST -0500 ##############

2020-08-05 17:45:18 350 packets transmitted, 349 received, 0% packet loss, time 20949732ms
2020-08-05 17:45:18 rtt min/avg/max/mdev = 32.708/63.177/350.206/27.978 ms

############## carina - 08/05/20 23:54:44 EST -0500 ##############

2020-08-06 05:47:16 350 packets transmitted, 349 received, 0% packet loss, time 20949068ms
2020-08-06 05:47:16 rtt min/avg/max/mdev = 39.661/351.400/101409.187/5417.317 ms, pipe 2

############## carina - 08/06/20 11:55:09 EST -0500 ##############

2020-08-06 17:44:24 350 packets transmitted, 350 received, 0% packet loss, time 20955017ms
2020-08-06 17:44:24 rtt min/avg/max/mdev = 34.418/59.389/1102.611/57.934 ms

############## carina - 08/06/20 23:54:46 EST -0500 ##############

2020-08-07 05:44:00 350 packets transmitted, 350 received, 0% packet loss, time 20954373ms
2020-08-07 05:44:00 rtt min/avg/max/mdev = 28.191/52.278/111.443/12.578 ms

############## carina - 08/07/20 11:55:13 EST -0500 ##############

2020-08-07 17:45:27 350 packets transmitted, 349 received, 0% packet loss, time 20954731ms
2020-08-07 17:45:27 rtt min/avg/max/mdev = 30.029/87.201/4009.102/233.847 ms

############## carina - 08/07/20 23:54:46 EST -0500 ##############

2020-08-08 05:43:57 350 packets transmitted, 350 received, 0% packet loss, time 20950916ms
2020-08-08 05:43:57 rtt min/avg/max/mdev = 30.958/44.284/95.878/7.230 ms

############## carina - 08/08/20 11:55:09 EST -0500 ##############

2020-08-08 17:44:24 350 packets transmitted, 350 received, 0% packet loss, time 20955113ms
2020-08-08 17:44:24 rtt min/avg/max/mdev = 29.482/61.013/232.388/26.712 ms

############## carina - 08/08/20 23:54:45 EST -0500 ##############

2020-08-09 05:44:00 350 packets transmitted, 350 received, 0% packet loss, time 20954258ms
2020-08-09 05:44:00 rtt min/avg/max/mdev = 28.104/41.294/118.370/7.957 ms

############## carina - 08/09/20 11:55:10 EST -0500 ##############

2020-08-09 17:44:21 350 packets transmitted, 350 received, 0% packet loss, time 20951533ms
2020-08-09 17:44:21 rtt min/avg/max/mdev = 31.436/55.711/428.503/28.298 ms

############## carina - 08/09/20 23:54:47 EST -0500 ##############

2020-08-10 05:44:02 350 packets transmitted, 350 received, 0% packet loss, time 20955085ms
2020-08-10 05:44:02 rtt min/avg/max/mdev = 27.986/40.251/96.704/6.788 ms

############## carina - 08/10/20 11:55:10 EST -0500 ##############

2020-08-10 17:44:26 350 packets transmitted, 350 received, 0% packet loss, time 20955247ms
2020-08-10 17:44:26 rtt min/avg/max/mdev = 32.836/57.005/2026.003/106.838 ms

############## carina - 08/10/20 23:54:46 EST -0500 ##############

2020-08-11 05:44:02 350 packets transmitted, 350 received, 0% packet loss, time 20955583ms
2020-08-11 05:44:02 rtt min/avg/max/mdev = 29.267/41.266/135.808/8.762 ms

############## carina - 08/11/20 11:55:11 EST -0500 ##############

2020-08-11 17:44:25 350 packets transmitted, 350 received, 0% packet loss, time 20954205ms
2020-08-11 17:44:25 rtt min/avg/max/mdev = 31.512/53.179/1259.583/68.215 ms

############## carina - 08/11/20 23:54:45 EST -0500 ##############

2020-08-12 05:44:01 350 packets transmitted, 350 received, 0% packet loss, time 20955417ms
2020-08-12 05:44:01 rtt min/avg/max/mdev = 28.328/43.914/242.833/13.518 ms

############## carina - 08/12/20 11:55:13 EST -0500 ##############

############## carina - 08/12/20 11:55:13 EST -0500 ##############


############## carina - 08/12/20 23:56:11 EST -0500 ##############

############## carina - 08/12/20 23:56:11 EST -0500 ##############


############## carina - 08/13/20 11:55:11 EST -0500 ##############

2020-08-13 17:44:20 350 packets transmitted, 350 received, 0% packet loss, time 20948882ms
2020-08-13 17:44:20 rtt min/avg/max/mdev = 33.176/82.367/1180.826/85.158 ms

############## carina - 08/13/20 23:54:48 EST -0500 ##############

2020-08-14 05:43:57 350 packets transmitted, 350 received, 0% packet loss, time 20949111ms
2020-08-14 05:43:57 rtt min/avg/max/mdev = 34.820/70.061/571.153/49.788 ms

############## carina - 08/14/20 11:55:11 EST -0500 ##############

2020-08-14 17:45:22 350 packets transmitted, 332 received, 5% packet loss, time 20951418ms
2020-08-14 17:45:22 rtt min/avg/max/mdev = 35.279/128.551/2821.723/270.604 ms

############## carina - 08/14/20 23:54:45 EST -0500 ##############

2020-08-15 05:43:54 350 packets transmitted, 350 received, 0% packet loss, time 20948740ms
2020-08-15 05:43:54 rtt min/avg/max/mdev = 44.386/57.740/178.819/8.938 ms

############## carina - 08/15/20 11:55:11 EST -0500 ##############

2020-08-15 17:53:17 350 packets transmitted, 309 received, 11% packet loss, time 20965639ms
2020-08-15 17:53:17 rtt min/avg/max/mdev = 48.831/6714.369/260184.331/28234.276 ms, pipe 5

############## carina - 08/15/20 23:54:45 EST -0500 ##############

2020-08-16 05:44:55 350 packets transmitted, 347 received, 0% packet loss, time 20949363ms
2020-08-16 05:44:55 rtt min/avg/max/mdev = 39.345/62.082/332.056/26.428 ms

############## carina - 08/16/20 12:01:11 EST -0500 ##############

2020-08-16 23:41:29 700 packets transmitted, 699 received, 0% packet loss, time 41957883ms
2020-08-16 23:41:29 rtt min/avg/max/mdev = 45.857/73.482/379.928/24.867 ms

############## carina - 08/17/20 00:00:47 EST -0500 ##############

2020-08-17 11:41:12 700 packets transmitted, 695 received, +1 errors, 0% packet loss, time 41965325ms
2020-08-17 11:41:12 rtt min/avg/max/mdev = 41.180/66.835/1555.500/69.023 ms

############## carina - 08/17/20 12:01:11 EST -0500 ##############

2020-08-17 23:41:29 700 packets transmitted, 698 received, 0% packet loss, time 41958017ms
2020-08-17 23:41:29 rtt min/avg/max/mdev = 40.447/86.171/2102.225/128.258 ms

############## carina - 08/17/20 23:55:46 EST -0500 ##############

2020-08-18 11:35:03 700 packets transmitted, 700 received, 0% packet loss, time 41956824ms
2020-08-18 11:35:03 rtt min/avg/max/mdev = 34.283/55.733/319.055/19.356 ms

############## carina - 08/18/20 11:56:13 EST -0500 ##############

2020-08-18 23:36:31 700 packets transmitted, 699 received, 0% packet loss, time 41957683ms
2020-08-18 23:36:31 rtt min/avg/max/mdev = 38.492/63.493/344.801/23.970 ms

############## carina - 08/18/20 23:55:56 EST -0500 ##############

2020-08-19 11:35:14 700 packets transmitted, 700 received, 0% packet loss, time 41957699ms
2020-08-19 11:35:14 rtt min/avg/max/mdev = 33.742/56.095/386.889/18.860 ms

############## carina - 08/19/20 11:56:13 EST -0500 ##############

2020-08-19 23:36:31 700 packets transmitted, 698 received, 0% packet loss, time 41957513ms
2020-08-19 23:36:31 rtt min/avg/max/mdev = 34.592/73.719/4297.126/161.799 ms

############## carina - 08/19/20 23:55:44 EST -0500 ##############

2020-08-20 11:35:03 700 packets transmitted, 700 received, 0% packet loss, time 41958095ms
2020-08-20 11:35:03 rtt min/avg/max/mdev = 33.359/53.725/391.264/17.617 ms

############## carina - 08/20/20 11:56:13 EST -0500 ##############

2020-08-20 23:36:31 700 packets transmitted, 698 received, 0% packet loss, time 41957507ms
2020-08-20 23:36:31 rtt min/avg/max/mdev = 30.759/59.584/325.722/17.348 ms

############## carina - 08/20/20 23:55:44 EST -0500 ##############

2020-08-21 11:35:02 700 packets transmitted, 700 received, 0% packet loss, time 41957295ms
2020-08-21 11:35:02 rtt min/avg/max/mdev = 33.794/51.836/137.521/12.103 ms

############## carina - 08/21/20 11:56:13 EST -0500 ##############

2020-08-21 23:35:31 700 packets transmitted, 700 received, 0% packet loss, time 41957918ms
2020-08-21 23:35:31 rtt min/avg/max/mdev = 34.738/79.761/5570.746/259.585 ms

############## carina - 08/21/20 23:55:48 EST -0500 ##############

############## carina - 08/21/20 23:55:48 EST -0500 ##############


############## carina - 08/22/20 11:56:14 EST -0500 ##############

2020-08-22 23:36:39 700 packets transmitted, 690 received, 1% packet loss, time 41964985ms
2020-08-22 23:36:39 rtt min/avg/max/mdev = 33.340/70.012/552.834/47.767 ms

############## carina - 08/22/20 23:55:51 EST -0500 ##############

2020-08-23 11:35:08 700 packets transmitted, 700 received, 0% packet loss, time 41957100ms
2020-08-23 11:35:08 rtt min/avg/max/mdev = 31.486/53.980/2292.344/86.382 ms

############## carina - 08/23/20 11:56:13 EST -0500 ##############

############## carina - 08/23/20 11:56:13 EST -0500 ##############


############## carina - 08/23/20 23:57:08 EST -0500 ##############

2020-08-24 11:37:28 700 packets transmitted, 699 received, 0% packet loss, time 41960044ms
2020-08-24 11:37:28 rtt min/avg/max/mdev = 31.302/49.848/461.405/22.779 ms

############## carina - 08/25/20 00:21:14 EST -0500 ##############

2020-08-25 12:01:36 700 packets transmitted, 697 received, 0% packet loss, time 41961847ms
2020-08-25 12:01:36 rtt min/avg/max/mdev = 32.578/56.360/1857.840/72.876 ms

############## carina - 08/25/20 12:15:43 EST -0500 ##############

2020-08-25 23:59:13 700 packets transmitted, 689 received, 1% packet loss, time 41957649ms
2020-08-25 23:59:13 rtt min/avg/max/mdev = 35.672/248.240/126434.496/4811.063 ms, pipe 3

############## carina - 08/26/20 00:21:14 EST -0500 ##############

2020-08-26 12:01:34 700 packets transmitted, 698 received, 0% packet loss, time 41959597ms
2020-08-26 12:01:34 rtt min/avg/max/mdev = 37.701/67.016/2318.358/105.116 ms

############## carina - 08/26/20 12:15:44 EST -0500 ##############

2020-08-26 23:59:32 700 packets transmitted, 541 received, 22% packet loss, time 42168285ms
2020-08-26 23:59:32 rtt min/avg/max/mdev = 33.013/114.380/4602.633/322.826 ms

############## carina - 08/27/20 00:21:17 EST -0500 ##############

2020-08-27 12:00:34 700 packets transmitted, 700 received, 0% packet loss, time 41956989ms
2020-08-27 12:00:34 rtt min/avg/max/mdev = 32.560/48.507/128.852/11.836 ms

############## carina - 08/27/20 12:15:45 EST -0500 ##############

2020-08-27 23:56:02 700 packets transmitted, 699 received, 0% packet loss, time 41956757ms
2020-08-27 23:56:02 rtt min/avg/max/mdev = 40.021/70.070/268.869/27.513 ms

############## carina - 08/28/20 00:21:14 EST -0500 ##############

2020-08-28 12:00:31 700 packets transmitted, 700 received, 0% packet loss, time 41957061ms
2020-08-28 12:00:31 rtt min/avg/max/mdev = 34.531/55.210/564.297/25.540 ms

############## carina - 08/28/20 12:15:46 EST -0500 ##############

2020-08-28 23:56:04 700 packets transmitted, 698 received, 0% packet loss, time 41957994ms
2020-08-28 23:56:04 rtt min/avg/max/mdev = 35.969/74.683/287.447/29.217 ms

############## carina - 08/29/20 00:21:15 EST -0500 ##############

2020-08-29 12:00:33 700 packets transmitted, 700 received, 0% packet loss, time 41957711ms
2020-08-29 12:00:33 rtt min/avg/max/mdev = 33.348/63.489/463.860/26.448 ms

############## carina - 08/29/20 12:15:45 EST -0500 ##############

2020-08-29 23:55:02 700 packets transmitted, 700 received, 0% packet loss, time 41956613ms
2020-08-29 23:55:02 rtt min/avg/max/mdev = 33.784/55.574/194.741/17.050 ms

############## carina - 08/30/20 00:21:15 EST -0500 ##############

2020-08-30 12:01:32 700 packets transmitted, 699 received, 0% packet loss, time 41956593ms
2020-08-30 12:01:32 rtt min/avg/max/mdev = 31.063/54.735/299.634/22.365 ms

############## carina - 08/30/20 12:15:47 EST -0500 ##############

2020-08-30 23:56:04 700 packets transmitted, 697 received, 0% packet loss, time 41957562ms
2020-08-30 23:56:04 rtt min/avg/max/mdev = 31.754/75.041/326.914/32.133 ms

############## carina - 08/31/20 00:21:16 EST -0500 ##############

2020-08-31 12:00:33 700 packets transmitted, 700 received, 0% packet loss, time 41957279ms
2020-08-31 12:00:33 rtt min/avg/max/mdev = 33.195/58.495/541.199/24.172 ms

############## carina - 08/31/20 12:15:42 EST -0500 ##############

2020-08-31 23:55:58 700 packets transmitted, 697 received, 0% packet loss, time 41955930ms
2020-08-31 23:55:58 rtt min/avg/max/mdev = 35.909/81.196/177.783/32.248 ms

############## carina - 09/01/20 00:21:24 EST -0500 ##############

2020-09-01 12:00:40 700 packets transmitted, 700 received, 0% packet loss, time 41955929ms
2020-09-01 12:00:40 rtt min/avg/max/mdev = 31.247/50.793/129.693/15.256 ms

############## carina - 09/01/20 12:15:45 EST -0500 ##############

2020-09-01 23:59:58 700 packets transmitted, 693 received, 1% packet loss, time 42182121ms
2020-09-01 23:59:58 rtt min/avg/max/mdev = 39.686/151.655/35736.504/1360.659 ms

############## carina - 09/02/20 00:21:17 EST -0500 ##############

2020-09-02 12:09:15 700 packets transmitted, 627 received, 10% packet loss, time 41991021ms
2020-09-02 12:09:15 rtt min/avg/max/mdev = 35.211/1199.759/243639.708/13702.029 ms, pipe 5

############## carina - 09/02/20 12:17:10 EST -0500 ##############

############## carina - 09/02/20 12:17:10 EST -0500 ##############


############## carina - 09/03/20 08:12:13 EST -0500 ##############

############## carina - 09/03/20 08:12:13 EST -0500 ##############


############## carina - 09/03/20 12:15:44 EST -0500 ##############

2020-09-03 23:55:03 700 packets transmitted, 700 received, 0% packet loss, time 41958921ms
2020-09-03 23:55:03 rtt min/avg/max/mdev = 32.070/64.721/311.971/41.907 ms

############## carina - 09/04/20 00:21:16 EST -0500 ##############

2020-09-04 12:00:34 700 packets transmitted, 700 received, 0% packet loss, time 41957416ms
2020-09-04 12:00:34 rtt min/avg/max/mdev = 29.322/48.987/351.358/20.634 ms

############## carina - 09/04/20 12:15:45 EST -0500 ##############

2020-09-04 23:56:02 700 packets transmitted, 697 received, 0% packet loss, time 41957132ms
2020-09-04 23:56:02 rtt min/avg/max/mdev = 35.425/104.247/2124.038/186.943 ms

############## carina - 09/05/20 00:21:18 EST -0500 ##############

2020-09-05 12:01:39 700 packets transmitted, 688 received, 1% packet loss, time 41960697ms
2020-09-05 12:01:39 rtt min/avg/max/mdev = 29.093/91.810/4116.450/276.573 ms

############## carina - 09/05/20 12:15:51 EST -0500 ##############

2020-09-05 23:56:09 700 packets transmitted, 690 received, 1% packet loss, time 41958744ms
2020-09-05 23:56:09 rtt min/avg/max/mdev = 30.799/203.247/7004.943/631.107 ms

############## carina - 09/06/20 00:21:17 EST -0500 ##############

2020-09-06 12:01:37 700 packets transmitted, 692 received, 1% packet loss, time 41959599ms
2020-09-06 12:01:37 rtt min/avg/max/mdev = 28.920/83.156/18138.674/688.755 ms

############## carina - 09/06/20 12:15:48 EST -0500 ##############

2020-09-06 23:56:04 700 packets transmitted, 698 received, 0% packet loss, time 41956582ms
2020-09-06 23:56:04 rtt min/avg/max/mdev = 33.057/98.191/1034.324/96.049 ms

############## carina - 09/07/20 00:21:18 EST -0500 ##############

2020-09-07 12:00:35 700 packets transmitted, 700 received, 0% packet loss, time 41957163ms
2020-09-07 12:00:35 rtt min/avg/max/mdev = 27.908/60.276/531.704/49.514 ms

############## carina - 09/07/20 12:15:48 EST -0500 ##############

############## carina - 09/07/20 12:15:48 EST -0500 ##############


############## carina - 09/08/20 00:21:19 EST -0500 ##############

2020-09-08 12:01:40 700 packets transmitted, 697 received, 0% packet loss, time 41960740ms
2020-09-08 12:01:40 rtt min/avg/max/mdev = 30.767/86.233/296.332/56.144 ms

############## carina - 09/08/20 12:15:48 EST -0500 ##############

2020-09-08 23:56:09 700 packets transmitted, 698 received, 0% packet loss, time 41960706ms
2020-09-08 23:56:09 rtt min/avg/max/mdev = 30.409/90.233/5103.652/228.491 ms

############## carina - 09/09/20 12:27:44 EST -0500 ##############

2020-09-10 00:08:17 700 packets transmitted, 631 received, 9% packet loss, time 41972656ms
2020-09-10 00:08:17 rtt min/avg/max/mdev = 33.706/96.544/1897.844/166.187 ms

############## carina - 09/10/20 00:21:18 EST -0500 ##############

2020-09-10 12:00:37 700 packets transmitted, 700 received, 0% packet loss, time 41958700ms
2020-09-10 12:00:37 rtt min/avg/max/mdev = 32.049/51.920/1696.541/66.305 ms

############## carina - 09/10/20 12:15:45 EST -0500 ##############

2020-09-10 23:55:02 700 packets transmitted, 700 received, 0% packet loss, time 41957121ms
2020-09-10 23:55:02 rtt min/avg/max/mdev = 32.882/59.432/1300.123/54.407 ms

############## carina - 09/11/20 00:21:19 EST -0500 ##############

2020-09-11 12:01:38 700 packets transmitted, 699 received, 0% packet loss, time 41958530ms
2020-09-11 12:01:38 rtt min/avg/max/mdev = 31.458/63.202/876.930/70.617 ms

############## carina - 09/11/20 12:15:45 EST -0500 ##############

2020-09-11 23:55:03 700 packets transmitted, 700 received, 0% packet loss, time 41957826ms
2020-09-11 23:55:03 rtt min/avg/max/mdev = 34.118/98.553/2379.608/149.860 ms

############## carina - 09/12/20 00:21:19 EST -0500 ##############

2020-09-12 12:01:38 700 packets transmitted, 697 received, 0% packet loss, time 41959365ms
2020-09-12 12:01:38 rtt min/avg/max/mdev = 28.286/51.423/324.525/26.929 ms

############## carina - 09/12/20 12:15:52 EST -0500 ##############

2020-09-12 23:56:09 700 packets transmitted, 698 received, 0% packet loss, time 41957438ms
2020-09-12 23:56:09 rtt min/avg/max/mdev = 33.338/80.908/2021.932/104.587 ms

############## carina - 09/13/20 00:21:19 EST -0500 ##############

2020-09-13 12:01:37 700 packets transmitted, 696 received, 0% packet loss, time 41958140ms
2020-09-13 12:01:37 rtt min/avg/max/mdev = 29.448/61.584/672.112/57.885 ms

############## carina - 09/13/20 12:15:45 EST -0500 ##############

2020-09-13 23:55:56 700 packets transmitted, 692 received, 1% packet loss, time 41950948ms
2020-09-13 23:55:56 rtt min/avg/max/mdev = 31.426/101.115/1164.742/125.386 ms

############## carina - 09/14/20 00:21:20 EST -0500 ##############

2020-09-14 12:01:40 700 packets transmitted, 696 received, 0% packet loss, time 41960122ms
2020-09-14 12:01:40 rtt min/avg/max/mdev = 28.832/50.435/716.647/31.994 ms

############## carina - 09/14/20 12:15:44 EST -0500 ##############

2020-09-14 23:56:06 700 packets transmitted, 682 received, 2% packet loss, time 41961755ms
2020-09-14 23:56:06 rtt min/avg/max/mdev = 35.499/85.899/4066.546/158.571 ms

############## carina - 09/15/20 00:21:20 EST -0500 ##############

2020-09-15 12:10:04 700 packets transmitted, 686 received, 2% packet loss, time 41965226ms
2020-09-15 12:10:04 rtt min/avg/max/mdev = 32.889/1224.873/279092.961/15372.970 ms, pipe 5

############## carina - 09/15/20 12:17:08 EST -0500 ##############

2020-09-15 23:57:26 700 packets transmitted, 681 received, 2% packet loss, time 41958216ms
2020-09-15 23:57:26 rtt min/avg/max/mdev = 34.780/118.120/7622.975/364.430 ms

############## carina - 09/17/20 00:21:22 EST -0500 ##############

2020-09-17 12:01:41 700 packets transmitted, 694 received, 0% packet loss, time 41959618ms
2020-09-17 12:01:41 rtt min/avg/max/mdev = 33.681/94.279/6895.461/333.277 ms

############## carina - 09/18/20 00:21:22 EST -0500 ##############

2020-09-18 12:01:40 700 packets transmitted, 699 received, 0% packet loss, time 41958915ms
2020-09-18 12:01:40 rtt min/avg/max/mdev = 31.129/105.629/4323.683/374.224 ms

############## carina - 09/19/20 00:21:23 EST -0500 ##############

2020-09-19 12:00:41 700 packets transmitted, 700 received, 0% packet loss, time 41958434ms
2020-09-19 12:00:41 rtt min/avg/max/mdev = 29.563/105.357/6820.626/393.277 ms

############## carina - 09/20/20 00:21:22 EST -0500 ##############

2020-09-20 12:01:41 700 packets transmitted, 697 received, 0% packet loss, time 41958487ms
2020-09-20 12:01:41 rtt min/avg/max/mdev = 27.573/55.135/1865.538/75.536 ms

############## carina - 09/21/20 00:21:23 EST -0500 ##############

2020-09-21 12:01:43 700 packets transmitted, 697 received, 0% packet loss, time 41959827ms
2020-09-21 12:01:43 rtt min/avg/max/mdev = 29.497/60.931/884.866/50.201 ms

############## carina - 09/22/20 00:21:23 EST -0500 ##############

2020-09-22 12:00:42 700 packets transmitted, 700 received, 0% packet loss, time 41958621ms
2020-09-22 12:00:42 rtt min/avg/max/mdev = 34.771/57.076/263.139/16.577 ms

############## carina - 09/23/20 00:21:23 EST -0500 ##############

2020-09-23 12:00:41 700 packets transmitted, 700 received, 0% packet loss, time 41958236ms
2020-09-23 12:00:41 rtt min/avg/max/mdev = 29.969/61.069/199.363/15.771 ms

############## carina - 09/24/20 00:21:27 EST -0500 ##############

2020-09-24 12:00:46 700 packets transmitted, 700 received, 0% packet loss, time 41958885ms
2020-09-24 12:00:46 rtt min/avg/max/mdev = 27.028/41.735/136.234/7.666 ms

############## carina - 09/26/20 12:15:48 EST -0500 ##############

2020-09-26 23:55:06 700 packets transmitted, 700 received, 0% packet loss, time 41957660ms
2020-09-26 23:55:06 rtt min/avg/max/mdev = 36.746/62.982/601.214/33.744 ms

############## carina - 09/27/20 00:21:29 EST -0500 ##############

2020-09-27 12:00:47 700 packets transmitted, 700 received, 0% packet loss, time 41958005ms
2020-09-27 12:00:47 rtt min/avg/max/mdev = 37.380/62.362/1589.440/67.252 ms

############## carina - 09/27/20 12:15:44 EST -0500 ##############

2020-09-27 23:55:02 700 packets transmitted, 700 received, 0% packet loss, time 41957894ms
2020-09-27 23:55:02 rtt min/avg/max/mdev = 35.362/66.994/402.749/30.499 ms

############## carina - 09/28/20 00:21:23 EST -0500 ##############

2020-09-28 12:00:41 700 packets transmitted, 700 received, 0% packet loss, time 41957651ms
2020-09-28 12:00:41 rtt min/avg/max/mdev = 38.477/66.067/776.549/51.522 ms

############## carina - 09/28/20 12:15:42 EST -0500 ##############

2020-09-28 23:55:59 700 packets transmitted, 699 received, 0% packet loss, time 41956695ms
2020-09-28 23:55:59 rtt min/avg/max/mdev = 35.115/79.893/1514.616/85.254 ms

############## carina - 09/29/20 00:21:24 EST -0500 ##############

2020-09-29 12:00:42 700 packets transmitted, 700 received, 0% packet loss, time 41957561ms
2020-09-29 12:00:42 rtt min/avg/max/mdev = 35.030/55.224/223.072/18.130 ms

############## carina - 09/29/20 12:17:15 EST -0500 ##############

2020-09-29 23:57:34 700 packets transmitted, 698 received, 0% packet loss, time 41958549ms
2020-09-29 23:57:34 rtt min/avg/max/mdev = 30.267/167.288/8149.889/469.301 ms

############## carina - 09/30/20 00:21:26 EST -0500 ##############

2020-09-30 12:00:43 700 packets transmitted, 700 received, 0% packet loss, time 41956963ms
2020-09-30 12:00:43 rtt min/avg/max/mdev = 35.763/56.384/420.886/24.811 ms

############## carina - 09/30/20 12:15:44 EST -0500 ##############

2020-09-30 23:56:01 700 packets transmitted, 699 received, 0% packet loss, time 41957491ms
2020-09-30 23:56:01 rtt min/avg/max/mdev = 35.687/95.227/823.304/130.132 ms

############## carina - 10/06/20 00:21:29 EST -0500 ##############

2020-10-06 12:01:54 700 packets transmitted, 671 received, 4% packet loss, time 41965160ms
2020-10-06 12:01:54 rtt min/avg/max/mdev = 45.243/106.780/8552.128/348.252 ms

############## carina - 10/06/20 12:15:40 EST -0500 ##############

2020-10-06 23:55:57 700 packets transmitted, 693 received, 1% packet loss, time 41957369ms
2020-10-06 23:55:57 rtt min/avg/max/mdev = 44.898/77.404/681.008/39.400 ms

############## carina - 10/07/20 00:21:29 EST -0500 ##############

2020-10-07 12:00:45 700 packets transmitted, 700 received, 0% packet loss, time 41956436ms
2020-10-07 12:00:45 rtt min/avg/max/mdev = 46.099/74.403/1444.652/59.869 ms

############## carina - 10/08/20 00:21:29 EST -0500 ##############

2020-10-08 12:01:49 700 packets transmitted, 682 received, 2% packet loss, time 41960442ms
2020-10-08 12:01:49 rtt min/avg/max/mdev = 46.646/74.740/922.463/61.074 ms

############## carina - 10/09/20 00:21:30 EST -0500 ##############

2020-10-09 12:02:43 700 packets transmitted, 644 received, 8% packet loss, time 42012777ms
2020-10-09 12:02:43 rtt min/avg/max/mdev = 34.185/71.302/1549.814/108.305 ms

############## carina - 10/10/20 00:21:29 EST -0500 ##############

2020-10-10 13:09:27 700 packets transmitted, 447 received, 36% packet loss, time 41958975ms
2020-10-10 13:09:27 rtt min/avg/max/mdev = 36.515/11025.397/2059268.462/123111.481 ms, pipe 35

############## carina - 10/11/20 00:21:30 EST -0500 ##############

2020-10-11 12:51:21 700 packets transmitted, 254 received, 63% packet loss, time 41950067ms
2020-10-11 12:51:21 rtt min/avg/max/mdev = 41.138/41632.299/1520333.555/-26573254775954.-157 ms, pipe 26

############## carina - 10/12/20 00:21:31 EST -0500 ##############

2020-10-12 12:09:40 700 packets transmitted, 657 received, 6% packet loss, time 41965564ms
2020-10-12 12:09:40 rtt min/avg/max/mdev = 34.358/1539.699/262095.165/15425.594 ms, pipe 5

############## carina - 10/13/20 00:21:30 EST -0500 ##############

2020-10-14 00:03:29 1420 packets transmitted, 1381 received, 2% packet loss, time 85182864ms
2020-10-14 00:03:29 rtt min/avg/max/mdev = 35.729/306.047/67902.746/2189.010 ms, pipe 2

############## carina - 10/14/20 00:21:31 EST -0500 ##############

2020-10-15 00:07:47 1420 packets transmitted, 1169 received, 17% packet loss, time 85516714ms
2020-10-15 00:07:47 rtt min/avg/max/mdev = 34.428/93.472/2857.585/159.820 ms

############## carina - 10/16/20 00:21:31 EST -0500 ##############

2020-10-17 00:05:42 1420 packets transmitted, 1321 received, 6% packet loss, time 85197514ms
2020-10-17 00:05:42 rtt min/avg/max/mdev = 36.059/268.253/126720.845/4876.094 ms, pipe 3

############## carina - 10/17/20 00:21:31 EST -0500 ##############

2020-10-18 00:02:08 1420 packets transmitted, 1415 received, 0% packet loss, time 85176398ms
2020-10-18 00:02:08 rtt min/avg/max/mdev = 31.043/64.069/1871.388/64.368 ms

############## carina - 10/18/20 00:21:32 EST -0500 ##############

2020-10-19 00:05:51 1420 packets transmitted, 1376 received, 3% packet loss, time 85194251ms
2020-10-19 00:05:51 rtt min/avg/max/mdev = 36.151/525.569/132676.145/6939.657 ms, pipe 3

############## carina - 10/25/20 00:21:34 EST -0500 ##############

2020-10-26 00:05:46 1420 packets transmitted, 1397 received, 1% packet loss, time 85185395ms
2020-10-26 00:05:46 rtt min/avg/max/mdev = 27.134/670.782/132872.854/8172.897 ms, pipe 3

############## carina - 10/26/20 00:21:35 EST -0500 ##############

2020-10-27 00:08:26 1420 packets transmitted, 1125 received, 20% packet loss, time 85298286ms
2020-10-27 00:08:26 rtt min/avg/max/mdev = 31.041/1585.170/156079.948/12401.239 ms, pipe 3

############## carina - 10/27/20 00:21:35 EST -0500 ##############

############## carina - 10/27/20 00:21:35 EST -0500 ##############


############## carina - 10/28/20 00:21:35 EST -0500 ##############

2020-10-29 00:06:03 1420 packets transmitted, 1341 received, 5% packet loss, time 85203419ms
2020-10-29 00:06:03 rtt min/avg/max/mdev = 28.519/336.594/131964.868/5226.469 ms, pipe 3

############## carina - 10/29/20 00:21:36 EST -0500 ##############

2020-10-30 00:02:15 1420 packets transmitted, 1416 received, 0% packet loss, time 85179836ms
2020-10-30 00:02:15 rtt min/avg/max/mdev = 30.477/60.533/360.266/21.295 ms

############## carina - 10/30/20 00:21:35 EST -0500 ##############

2020-10-31 00:02:11 1420 packets transmitted, 1419 received, 0% packet loss, time 85175144ms
2020-10-31 00:02:11 rtt min/avg/max/mdev = 27.609/53.424/758.822/26.763 ms

############## carina - 10/31/20 00:21:37 EST -0500 ##############

2020-11-01 00:04:32 1420 packets transmitted, 1404 received, 1% packet loss, time 85178499ms
2020-11-01 00:04:32 rtt min/avg/max/mdev = 30.142/151.862/98189.187/2816.958 ms, pipe 2

############## carina - 11/01/20 00:21:37 EST -0500 ##############

2020-11-02 00:04:03 1420 packets transmitted, 1403 received, 1% packet loss, time 85184481ms
2020-11-02 00:04:03 rtt min/avg/max/mdev = 29.655/127.494/80767.770/2217.037 ms, pipe 2

############## carina - 11/03/20 00:21:38 EST -0500 ##############

2020-11-04 00:02:21 1420 packets transmitted, 1388 received, 2% packet loss, time 85182791ms
2020-11-04 00:02:21 rtt min/avg/max/mdev = 32.199/64.210/9879.469/279.944 ms

############## carina - 11/04/20 00:21:40 EST -0500 ##############

2020-11-05 00:01:16 1420 packets transmitted, 1420 received, 0% packet loss, time 85175630ms
2020-11-05 00:01:16 rtt min/avg/max/mdev = 28.170/50.799/184.519/16.397 ms

############## carina - 11/05/20 00:21:40 EST -0500 ##############

2020-11-06 00:05:44 1420 packets transmitted, 1416 received, 0% packet loss, time 85181230ms
2020-11-06 00:05:44 rtt min/avg/max/mdev = 28.405/232.748/131664.452/4841.956 ms, pipe 3

############## carina - 11/06/20 00:21:41 EST -0500 ##############

2020-11-07 00:01:16 1420 packets transmitted, 1420 received, 0% packet loss, time 85175182ms
2020-11-07 00:01:16 rtt min/avg/max/mdev = 29.198/52.908/444.820/27.536 ms

############## carina - 11/07/20 00:21:40 EST -0500 ##############

2020-11-08 00:01:16 1420 packets transmitted, 1420 received, 0% packet loss, time 85176169ms
2020-11-08 00:01:16 rtt min/avg/max/mdev = 27.542/53.461/662.101/27.018 ms

############## carina - 11/08/20 00:21:42 EST -0500 ##############

2020-11-09 00:02:23 1420 packets transmitted, 1407 received, 0% packet loss, time 85180610ms
2020-11-09 00:02:23 rtt min/avg/max/mdev = 28.475/58.247/5558.995/148.428 ms

############## carina - 11/09/20 00:21:41 EST -0500 ##############

2020-11-10 00:02:17 1420 packets transmitted, 1419 received, 0% packet loss, time 85176000ms
2020-11-10 00:02:17 rtt min/avg/max/mdev = 28.407/52.320/297.448/18.180 ms

############## carina - 11/10/20 00:21:43 EST -0500 ##############

2020-11-11 00:02:17 1420 packets transmitted, 1418 received, 0% packet loss, time 85174245ms
2020-11-11 00:02:17 rtt min/avg/max/mdev = 30.711/53.516/1895.548/54.987 ms

############## carina - 11/11/20 00:21:43 EST -0500 ##############

2020-11-12 00:02:21 1420 packets transmitted, 1418 received, 0% packet loss, time 85177561ms
2020-11-12 00:02:21 rtt min/avg/max/mdev = 27.764/46.967/155.823/13.218 ms

############## carina - 11/12/20 00:21:43 EST -0500 ##############

2020-11-13 00:01:19 1420 packets transmitted, 1420 received, 0% packet loss, time 85175621ms
2020-11-13 00:01:19 rtt min/avg/max/mdev = 27.874/53.263/302.639/23.200 ms

############## carina - 11/13/20 00:21:45 EST -0500 ##############

2020-11-14 00:02:24 1420 packets transmitted, 1416 received, 0% packet loss, time 85179333ms
2020-11-14 00:02:24 rtt min/avg/max/mdev = 32.810/57.851/3358.585/90.321 ms

############## carina - 11/14/20 00:21:42 EST -0500 ##############

2020-11-15 00:01:18 1420 packets transmitted, 1420 received, 0% packet loss, time 85174995ms
2020-11-15 00:01:18 rtt min/avg/max/mdev = 29.433/54.008/254.068/18.812 ms

############## carina - 11/15/20 00:21:44 EST -0500 ##############

2020-11-16 00:02:19 1420 packets transmitted, 1418 received, 0% packet loss, time 85174678ms
2020-11-16 00:02:19 rtt min/avg/max/mdev = 29.384/62.417/427.428/40.370 ms

############## carina - 11/16/20 00:21:50 EST -0500 ##############

2020-11-17 00:01:25 1420 packets transmitted, 1420 received, 0% packet loss, time 85175136ms
2020-11-17 00:01:25 rtt min/avg/max/mdev = 30.039/54.683/1916.518/53.431 ms

############## carina - 11/17/20 00:21:45 EST -0500 ##############

2020-11-18 00:03:49 1420 packets transmitted, 1383 received, +1 duplicates, 2% packet loss, time 85191135ms
2020-11-18 00:03:49 rtt min/avg/max/mdev = 28.179/111.258/66115.666/1781.065 ms, pipe 2

############## carina - 11/18/20 00:21:45 EST -0500 ##############

2020-11-19 00:01:20 1420 packets transmitted, 1420 received, 0% packet loss, time 85175356ms
2020-11-19 00:01:20 rtt min/avg/max/mdev = 31.648/68.390/283.242/17.369 ms

############## carina - 11/19/20 00:21:48 EST -0500 ##############

2020-11-20 00:02:23 1420 packets transmitted, 1419 received, 0% packet loss, time 85175248ms
2020-11-20 00:02:23 rtt min/avg/max/mdev = 29.645/52.381/401.003/19.852 ms

############## carina - 11/20/20 00:21:48 EST -0500 ##############

2020-11-21 00:01:25 1420 packets transmitted, 1420 received, 0% packet loss, time 85176865ms
2020-11-21 00:01:25 rtt min/avg/max/mdev = 29.467/51.318/266.049/13.248 ms

############## carina - 11/21/20 00:21:48 EST -0500 ##############

2020-11-22 00:01:24 1420 packets transmitted, 1420 received, 0% packet loss, time 85176330ms
2020-11-22 00:01:24 rtt min/avg/max/mdev = 27.563/52.993/869.855/33.576 ms

############## carina - 11/22/20 00:21:49 EST -0500 ##############

2020-11-23 00:02:24 1420 packets transmitted, 1418 received, 0% packet loss, time 85175044ms
2020-11-23 00:02:24 rtt min/avg/max/mdev = 28.466/62.081/430.685/27.289 ms

############## carina - 11/23/20 00:21:49 EST -0500 ##############

2020-11-24 00:02:30 1420 packets transmitted, 1412 received, 0% packet loss, time 85181355ms
2020-11-24 00:02:30 rtt min/avg/max/mdev = 29.532/53.621/257.249/16.494 ms

############## carina - 11/24/20 00:21:50 EST -0500 ##############

2020-11-25 00:02:30 1420 packets transmitted, 1413 received, 0% packet loss, time 85180689ms
2020-11-25 00:02:30 rtt min/avg/max/mdev = 28.479/65.260/766.339/50.063 ms

############## carina - 11/25/20 00:21:51 EST -0500 ##############

2020-11-26 00:02:54 1420 packets transmitted, 1337 received, 5% packet loss, time 85203379ms
2020-11-26 00:02:54 rtt min/avg/max/mdev = 30.990/80.692/10151.600/299.188 ms

############## carina - 11/26/20 00:21:52 EST -0500 ##############

2020-11-27 00:02:28 1420 packets transmitted, 1419 received, 0% packet loss, time 85175465ms
2020-11-27 00:02:28 rtt min/avg/max/mdev = 30.118/62.382/394.190/24.668 ms

############## carina - 11/27/20 00:21:51 EST -0500 ##############

2020-11-28 00:02:38 1420 packets transmitted, 1368 received, 3% packet loss, time 85187572ms
2020-11-28 00:02:39 rtt min/avg/max/mdev = 29.246/69.293/1537.165/56.446 ms

############## carina - 11/28/20 00:21:52 EST -0500 ##############

2020-11-29 00:02:27 1420 packets transmitted, 1405 received, 1% packet loss, time 85175594ms
2020-11-29 00:02:27 rtt min/avg/max/mdev = 28.649/63.603/674.591/30.454 ms

############## carina - 11/29/20 00:21:54 EST -0500 ##############

2020-11-30 00:02:45 1420 packets transmitted, 1370 received, 3% packet loss, time 85190354ms
2020-11-30 00:02:45 rtt min/avg/max/mdev = 29.546/69.518/595.181/38.676 ms

############## carina - 11/30/20 00:21:54 EST -0500 ##############

2020-12-01 00:02:35 1420 packets transmitted, 1375 received, 3% packet loss, time 85180564ms
2020-12-01 00:02:35 rtt min/avg/max/mdev = 29.703/87.898/2929.191/200.403 ms

############## carina - 12/01/20 00:21:54 EST -0500 ##############

2020-12-02 00:05:57 1420 packets transmitted, 1340 received, 5% packet loss, time 85201189ms
2020-12-02 00:05:57 rtt min/avg/max/mdev = 29.213/533.490/120696.926/6351.507 ms, pipe 2

############## carina - 12/02/20 00:21:56 EST -0500 ##############

2020-12-03 00:04:02 1420 packets transmitted, 1376 received, 3% packet loss, time 85187079ms
2020-12-03 00:04:02 rtt min/avg/max/mdev = 29.291/116.020/69345.606/1884.221 ms, pipe 2

############## carina - 12/03/20 00:21:57 EST -0500 ##############

2020-12-04 00:02:34 1420 packets transmitted, 1419 received, 0% packet loss, time 85176989ms
2020-12-04 00:02:34 rtt min/avg/max/mdev = 28.849/52.029/482.953/23.773 ms

############## carina - 12/05/20 00:21:58 EST -0500 ##############

2020-12-06 00:02:37 1420 packets transmitted, 1405 received, 1% packet loss, time 85178953ms
2020-12-06 00:02:37 rtt min/avg/max/mdev = 28.653/67.811/2483.545/88.267 ms

############## carina - 12/06/20 00:21:59 EST -0500 ##############

2020-12-07 00:02:35 1420 packets transmitted, 1416 received, 0% packet loss, time 85176849ms
2020-12-07 00:02:35 rtt min/avg/max/mdev = 30.977/60.791/1873.960/54.520 ms

############## carina - 12/07/20 00:22:01 EST -0500 ##############

2020-12-08 00:02:36 1420 packets transmitted, 1413 received, 0% packet loss, time 85175165ms
2020-12-08 00:02:36 rtt min/avg/max/mdev = 28.239/55.507/2050.963/71.397 ms

############## carina - 12/08/20 00:22:03 EST -0500 ##############

2020-12-09 00:02:45 1420 packets transmitted, 1392 received, 1% packet loss, time 85182358ms
2020-12-09 00:02:45 rtt min/avg/max/mdev = 34.011/69.726/1950.720/105.104 ms

############## carina - 12/09/20 00:22:04 EST -0500 ##############

2020-12-10 00:03:15 1420 packets transmitted, 1359 received, 4% packet loss, time 85210919ms
2020-12-10 00:03:15 rtt min/avg/max/mdev = 32.869/64.075/442.698/28.614 ms

############## carina - 12/10/20 00:22:03 EST -0500 ##############

############## carina - 12/10/20 00:22:03 EST -0500 ##############


############## carina - 12/11/20 00:22:07 EST -0500 ##############

2020-12-12 00:02:57 1420 packets transmitted, 1341 received, 5% packet loss, time 85189696ms
2020-12-12 00:02:57 rtt min/avg/max/mdev = 41.993/72.394/295.055/21.237 ms

############## carina - 12/12/20 00:22:05 EST -0500 ##############

2020-12-13 00:02:45 1420 packets transmitted, 1398 received, 1% packet loss, time 85179258ms
2020-12-13 00:02:45 rtt min/avg/max/mdev = 35.406/62.176/2137.049/63.417 ms

############## carina - 12/13/20 00:22:05 EST -0500 ##############

2020-12-14 00:02:41 1420 packets transmitted, 1409 received, 0% packet loss, time 85176211ms
2020-12-14 00:02:41 rtt min/avg/max/mdev = 32.235/56.804/2899.894/77.264 ms

############## carina - 12/14/20 00:22:07 EST -0500 ##############

2020-12-15 00:02:55 1420 packets transmitted, 1391 received, 2% packet loss, time 85188431ms
2020-12-15 00:02:55 rtt min/avg/max/mdev = 35.287/88.186/7979.418/298.242 ms

############## carina - 12/15/20 00:22:08 EST -0500 ##############

2020-12-16 00:02:44 1420 packets transmitted, 1413 received, 0% packet loss, time 85176694ms
2020-12-16 00:02:44 rtt min/avg/max/mdev = 35.359/77.995/1627.473/102.679 ms

############## carina - 12/16/20 00:22:09 EST -0500 ##############

2020-12-17 00:01:43 1420 packets transmitted, 1420 received, 0% packet loss, time 85173920ms
2020-12-17 00:01:43 rtt min/avg/max/mdev = 35.043/59.275/1473.859/55.559 ms

############## carina - 12/18/20 00:22:12 EST -0500 ##############

############## carina - 12/18/20 00:22:12 EST -0500 ##############


############## carina - 12/19/20 00:22:12 EST -0500 ##############

2020-12-20 00:08:09 1420 packets transmitted, 977 received, 31% packet loss, time 85367936ms
2020-12-20 00:08:09 rtt min/avg/max/mdev = 32.299/545.119/94332.593/4568.531 ms, pipe 2

############## carina - 12/20/20 00:22:14 EST -0500 ##############

2020-12-21 00:11:00 1420 packets transmitted, 773 received, 45% packet loss, time 85463548ms
2020-12-21 00:11:00 rtt min/avg/max/mdev = 81.828/1126.399/131384.996/6769.811 ms, pipe 3

############## carina - 12/22/20 00:22:15 EST -0500 ##############

############## carina - 12/22/20 00:22:15 EST -0500 ##############


############## carina - 12/23/20 00:22:17 EST -0500 ##############

############## carina - 12/23/20 00:22:17 EST -0500 ##############


############## carina - 12/24/20 00:22:17 EST -0500 ##############

############## carina - 12/24/20 00:22:17 EST -0500 ##############


############## carina - 12/25/20 00:22:18 EST -0500 ##############

2020-12-26 00:02:54 1420 packets transmitted, 1419 received, 0% packet loss, time 85175614ms
2020-12-26 00:02:54 rtt min/avg/max/mdev = 31.389/51.778/543.344/33.075 ms

############## carina - 12/26/20 00:22:20 EST -0500 ##############

2020-12-27 00:02:55 1420 packets transmitted, 1417 received, 0% packet loss, time 85175022ms
2020-12-27 00:02:55 rtt min/avg/max/mdev = 29.476/49.707/565.398/21.735 ms

############## carina - 12/27/20 00:22:22 EST -0500 ##############

2020-12-28 00:08:06 1420 packets transmitted, 781 received, 45% packet loss, time 85276676ms
2020-12-28 00:08:06 rtt min/avg/max/mdev = 29.756/783.664/133492.807/7719.664 ms, pipe 3

############## carina - 12/28/20 00:22:24 EST -0500 ##############

############## carina - 12/28/20 00:22:24 EST -0500 ##############


############## carina - 12/29/20 00:22:40 EST -0500 ##############

############## carina - 12/29/20 00:22:40 EST -0500 ##############


############## carina - 12/30/20 00:22:10 EST -0500 ##############

############## carina - 12/30/20 00:22:10 EST -0500 ##############


############## carina - 12/31/20 00:22:28 EST -0500 ##############

############## carina - 12/31/20 00:22:28 EST -0500 ##############


############## carina - 01/01/21 00:22:29 EST -0500 ##############

############## carina - 01/01/21 00:22:29 EST -0500 ##############


############## carina - 01/02/21 00:22:47 EST -0500 ##############

2021-01-03 00:06:00 1420 packets transmitted, 9 received, 99% packet loss, time 85333584ms
2021-01-03 00:06:00 rtt min/avg/max/mdev = 74.676/507.378/2381.204/700.544 ms

############## carina - 01/03/21 00:22:44 EST -0500 ##############

2021-01-04 00:01:56 --- 8.8.8.8 ping statistics ---
2021-01-04 00:01:56 1420 packets transmitted, 0 received, 100% packet loss, time 85142237ms

############## carina - 01/04/21 00:22:45 EST -0500 ##############

############## carina - 01/04/21 00:22:45 EST -0500 ##############


############## carina - 01/05/21 00:22:47 EST -0500 ##############

############## carina - 01/05/21 00:22:47 EST -0500 ##############


############## carina - 01/06/21 00:22:35 EST -0500 ##############

############## carina - 01/06/21 00:22:35 EST -0500 ##############


############## carina - 01/07/21 00:22:48 EST -0500 ##############

############## carina - 01/07/21 00:22:48 EST -0500 ##############


############## carina - 02/08/21 14:30:43 EST -0500 ##############

############## carina - 02/08/21 14:30:43 EST -0500 ##############


############## carina - 03/18/21 08:09:54 EST -0500 ##############

############## carina - 03/18/21 08:09:54 EST -0500 ##############


############## carina - 03/29/21 00:24:00 EST -0500 ##############

2021-03-29 23:59:11 284 packets transmitted, 284 received, 0% packet loss, time 84910967ms
2021-03-29 23:59:11 rtt min/avg/max/mdev = 40.261/59.132/174.372/13.516 ms

############## carina - 03/30/21 00:24:01 EST -0500 ##############

2021-03-30 23:59:12 284 packets transmitted, 284 received, 0% packet loss, time 84911760ms
2021-03-30 23:59:12 rtt min/avg/max/mdev = 36.483/64.952/473.585/32.589 ms

############## carina - 03/31/21 00:24:02 EST -0500 ##############

2021-03-31 23:59:11 284 packets transmitted, 284 received, 0% packet loss, time 84909719ms
2021-03-31 23:59:11 rtt min/avg/max/mdev = 36.671/85.307/1472.540/154.203 ms

############## carina - 04/01/21 00:24:01 EST -0500 ##############

2021-04-01 23:59:12 284 packets transmitted, 284 received, 0% packet loss, time 84911052ms
2021-04-01 23:59:12 rtt min/avg/max/mdev = 36.306/852.143/225148.988/13333.070 ms

############## carina - 04/02/21 00:24:03 EST -0500 ##############

2021-04-02 23:59:14 284 packets transmitted, 284 received, 0% packet loss, time 84910593ms
2021-04-02 23:59:14 rtt min/avg/max/mdev = 35.461/62.319/644.573/41.489 ms

############## carina - 04/03/21 00:24:04 EST -0500 ##############

2021-04-03 23:59:14 284 packets transmitted, 284 received, 0% packet loss, time 84909914ms
2021-04-03 23:59:14 rtt min/avg/max/mdev = 40.734/62.809/270.765/24.824 ms

############## carina - 04/04/21 00:24:04 EST -0500 ##############

2021-04-04 23:59:15 284 packets transmitted, 284 received, 0% packet loss, time 84910411ms
2021-04-04 23:59:15 rtt min/avg/max/mdev = 33.367/62.097/252.549/16.650 ms

############## carina - 04/05/21 00:24:05 EST -0500 ##############

2021-04-05 23:59:17 284 packets transmitted, 284 received, 0% packet loss, time 84911936ms
2021-04-05 23:59:17 rtt min/avg/max/mdev = 37.377/59.686/124.270/12.315 ms

############## carina - 04/06/21 00:24:06 EST -0500 ##############

2021-04-06 23:59:17 284 packets transmitted, 284 received, 0% packet loss, time 84911320ms
2021-04-06 23:59:17 rtt min/avg/max/mdev = 37.965/60.200/191.493/15.599 ms

############## carina - 04/07/21 00:24:06 EST -0500 ##############

2021-04-07 23:59:18 284 packets transmitted, 284 received, 0% packet loss, time 84911662ms
2021-04-07 23:59:18 rtt min/avg/max/mdev = 36.813/59.829/111.089/11.881 ms

############## carina - 04/09/21 00:24:07 EST -0500 ##############

2021-04-09 23:59:18 284 packets transmitted, 284 received, 0% packet loss, time 84910376ms
2021-04-09 23:59:18 rtt min/avg/max/mdev = 37.113/59.705/105.907/10.510 ms

############## carina - 04/10/21 00:24:07 EST -0500 ##############

2021-04-10 23:59:18 284 packets transmitted, 284 received, 0% packet loss, time 84911531ms
2021-04-10 23:59:18 rtt min/avg/max/mdev = 37.650/60.546/228.493/15.546 ms

############## carina - 04/11/21 00:24:06 EST -0500 ##############

2021-04-11 23:59:17 284 packets transmitted, 284 received, 0% packet loss, time 84910631ms
2021-04-11 23:59:17 rtt min/avg/max/mdev = 35.871/62.792/237.849/16.478 ms

############## carina - 04/12/21 00:24:10 EST -0500 ##############

2021-04-13 00:04:20 284 packets transmitted, 283 received, 0% packet loss, time 84910344ms
2021-04-13 00:04:20 rtt min/avg/max/mdev = 38.668/68.699/212.632/19.154 ms

############## carina - 04/13/21 00:24:07 EST -0500 ##############

2021-04-13 23:59:17 284 packets transmitted, 284 received, 0% packet loss, time 84910021ms
2021-04-13 23:59:17 rtt min/avg/max/mdev = 36.906/65.021/572.930/36.737 ms

############## carina - 04/14/21 00:24:07 EST -0500 ##############

2021-04-14 23:59:18 284 packets transmitted, 284 received, 0% packet loss, time 84910907ms
2021-04-14 23:59:18 rtt min/avg/max/mdev = 35.980/64.267/469.512/28.756 ms

############## carina - 04/15/21 00:24:09 EST -0500 ##############

2021-04-15 23:59:20 284 packets transmitted, 284 received, 0% packet loss, time 84911372ms
2021-04-15 23:59:20 rtt min/avg/max/mdev = 36.047/60.676/254.528/17.221 ms

############## carina - 04/16/21 00:24:08 EST -0500 ##############

2021-04-16 23:59:19 284 packets transmitted, 284 received, 0% packet loss, time 84910896ms
2021-04-16 23:59:19 rtt min/avg/max/mdev = 34.774/58.253/123.201/11.607 ms

############## carina - 04/17/21 00:24:09 EST -0500 ##############

2021-04-17 23:59:21 284 packets transmitted, 284 received, 0% packet loss, time 84911635ms
2021-04-17 23:59:21 rtt min/avg/max/mdev = 36.501/64.173/536.741/35.561 ms

############## carina - 04/18/21 00:24:08 EST -0500 ##############

2021-04-18 23:59:19 284 packets transmitted, 284 received, 0% packet loss, time 84911188ms
2021-04-18 23:59:19 rtt min/avg/max/mdev = 40.761/67.325/291.773/21.574 ms

############## carina - 04/19/21 00:24:09 EST -0500 ##############

2021-04-20 00:04:28 284 packets transmitted, 283 received, 0% packet loss, time 84919469ms
2021-04-20 00:04:28 rtt min/avg/max/mdev = 37.087/63.916/476.641/38.259 ms

############## carina - 04/20/21 00:24:10 EST -0500 ##############

2021-04-20 23:59:21 284 packets transmitted, 284 received, 0% packet loss, time 84910754ms
2021-04-20 23:59:21 rtt min/avg/max/mdev = 37.385/61.515/143.053/17.638 ms

############## carina - 04/21/21 00:24:09 EST -0500 ##############

2021-04-21 23:59:20 284 packets transmitted, 284 received, 0% packet loss, time 84909994ms
2021-04-21 23:59:20 rtt min/avg/max/mdev = 36.066/60.143/143.830/15.580 ms

############## carina - 04/22/21 00:24:10 EST -0500 ##############

2021-04-23 00:04:21 284 packets transmitted, 283 received, 0% packet loss, time 84910584ms
2021-04-23 00:04:21 rtt min/avg/max/mdev = 34.342/62.030/318.738/22.830 ms

############## carina - 04/23/21 00:24:11 EST -0500 ##############

2021-04-23 23:59:21 284 packets transmitted, 284 received, 0% packet loss, time 84909656ms
2021-04-23 23:59:21 rtt min/avg/max/mdev = 30.150/62.386/250.437/21.655 ms

############## carina - 04/24/21 00:24:12 EST -0500 ##############

2021-04-24 23:59:23 284 packets transmitted, 284 received, 0% packet loss, time 84910129ms
2021-04-24 23:59:23 rtt min/avg/max/mdev = 36.310/66.957/452.336/31.196 ms

############## carina - 04/25/21 00:24:13 EST -0500 ##############

2021-04-25 23:59:24 284 packets transmitted, 284 received, 0% packet loss, time 84910501ms
2021-04-25 23:59:24 rtt min/avg/max/mdev = 35.815/61.775/276.723/19.031 ms

############## carina - 04/26/21 00:24:13 EST -0500 ##############

2021-04-26 23:59:24 284 packets transmitted, 284 received, 0% packet loss, time 84911125ms
2021-04-26 23:59:24 rtt min/avg/max/mdev = 34.128/61.917/362.596/23.335 ms

############## carina - 04/27/21 00:24:15 EST -0500 ##############

2021-04-27 23:59:26 284 packets transmitted, 284 received, 0% packet loss, time 84911221ms
2021-04-27 23:59:26 rtt min/avg/max/mdev = 29.833/63.077/196.587/19.561 ms

############## carina - 04/28/21 00:24:14 EST -0500 ##############

2021-04-28 23:59:25 284 packets transmitted, 284 received, 0% packet loss, time 84911141ms
2021-04-28 23:59:25 rtt min/avg/max/mdev = 34.147/63.000/179.448/16.796 ms

############## carina - 04/30/21 00:24:14 EST -0500 ##############

2021-04-30 23:59:24 284 packets transmitted, 284 received, 0% packet loss, time 84910397ms
2021-04-30 23:59:24 rtt min/avg/max/mdev = 37.218/65.812/479.864/30.368 ms

############## carina - 05/01/21 00:24:14 EST -0500 ##############

2021-05-02 00:04:25 284 packets transmitted, 282 received, 0% packet loss, time 84910932ms
2021-05-02 00:04:25 rtt min/avg/max/mdev = 40.604/68.263/344.346/25.334 ms

############## carina - 05/02/21 00:24:16 EST -0500 ##############

2021-05-03 00:04:41 284 packets transmitted, 283 received, 0% packet loss, time 84924474ms
2021-05-03 00:04:41 rtt min/avg/max/mdev = 41.365/63.697/238.826/19.719 ms

############## carina - 05/03/21 00:24:14 EST -0500 ##############

2021-05-04 00:04:25 284 packets transmitted, 281 received, 1% packet loss, time 84910733ms
2021-05-04 00:04:25 rtt min/avg/max/mdev = 42.830/65.664/517.221/39.852 ms

############## carina - 05/04/21 00:24:18 EST -0500 ##############

2021-05-05 00:04:29 284 packets transmitted, 278 received, 2% packet loss, time 84910465ms
2021-05-05 00:04:29 rtt min/avg/max/mdev = 35.628/101.727/8639.547/523.821 ms

############## carina - 05/05/21 00:24:15 EST -0500 ##############

2021-05-05 23:59:26 284 packets transmitted, 284 received, 0% packet loss, time 84910345ms
2021-05-05 23:59:26 rtt min/avg/max/mdev = 40.325/62.714/211.906/17.915 ms

############## carina - 05/06/21 00:24:16 EST -0500 ##############

2021-05-07 00:04:26 284 packets transmitted, 283 received, 0% packet loss, time 84910473ms
2021-05-07 00:04:26 rtt min/avg/max/mdev = 38.812/59.442/102.876/10.469 ms

############## carina - 05/07/21 00:24:17 EST -0500 ##############

2021-05-08 00:04:28 284 packets transmitted, 281 received, 1% packet loss, time 84910927ms
2021-05-08 00:04:28 rtt min/avg/max/mdev = 36.263/59.904/174.635/14.737 ms

############## carina - 05/08/21 00:24:21 EST -0500 ##############

2021-05-09 00:04:31 284 packets transmitted, 282 received, 0% packet loss, time 84910434ms
2021-05-09 00:04:31 rtt min/avg/max/mdev = 38.473/64.207/716.608/50.051 ms

############## carina - 05/09/21 00:24:16 EST -0500 ##############

2021-05-10 00:04:27 284 packets transmitted, 283 received, 0% packet loss, time 84910382ms
2021-05-10 00:04:27 rtt min/avg/max/mdev = 37.127/62.984/205.711/19.623 ms

############## carina - 05/10/21 00:24:17 EST -0500 ##############

2021-05-10 23:59:27 284 packets transmitted, 284 received, 0% packet loss, time 84909960ms
2021-05-10 23:59:27 rtt min/avg/max/mdev = 40.542/63.696/489.673/36.441 ms

############## carina - 05/11/21 00:24:17 EST -0500 ##############

2021-05-11 23:59:29 284 packets transmitted, 284 received, 0% packet loss, time 84911845ms
2021-05-11 23:59:29 rtt min/avg/max/mdev = 38.811/63.512/541.284/31.588 ms

############## carina - 05/12/21 00:24:17 EST -0500 ##############

2021-05-12 23:59:29 284 packets transmitted, 284 received, 0% packet loss, time 84910417ms
2021-05-12 23:59:29 rtt min/avg/max/mdev = 40.148/70.109/1137.091/78.822 ms

############## carina - 05/13/21 00:24:17 EST -0500 ##############

2021-05-14 00:04:28 284 packets transmitted, 282 received, 0% packet loss, time 84910769ms
2021-05-14 00:04:28 rtt min/avg/max/mdev = 38.692/65.994/474.185/32.941 ms

############## carina - 05/14/21 00:24:19 EST -0500 ##############

2021-05-15 00:04:31 284 packets transmitted, 280 received, 1% packet loss, time 84911814ms
2021-05-15 00:04:31 rtt min/avg/max/mdev = 37.574/165.339/14629.217/1061.258 ms

############## carina - 05/15/21 00:24:18 EST -0500 ##############

2021-05-16 00:04:58 284 packets transmitted, 276 received, 2% packet loss, time 84922495ms
2021-05-16 00:04:58 rtt min/avg/max/mdev = 41.918/994.374/158403.524/11126.058 ms

############## carina - 05/16/21 00:24:19 EST -0500 ##############

2021-05-17 00:06:43 284 packets transmitted, 243 received, 14% packet loss, time 84925109ms
2021-05-17 00:06:43 rtt min/avg/max/mdev = 42.348/5460.626/209460.210/23269.503 ms

############## carina - 05/17/21 00:24:21 EST -0500 ##############

2021-05-18 00:04:59 284 packets transmitted, 236 received, 16% packet loss, time 84937093ms
2021-05-18 00:04:59 rtt min/avg/max/mdev = 44.174/776.732/119031.832/8215.402 ms

############## carina - 05/18/21 00:24:20 EST -0500 ##############

2021-05-19 00:07:18 284 packets transmitted, 265 received, 6% packet loss, time 84910414ms
2021-05-19 00:07:18 rtt min/avg/max/mdev = 43.684/2562.647/233921.023/18394.586 ms

############## carina - 05/19/21 00:24:19 EST -0500 ##############

2021-05-20 00:04:31 284 packets transmitted, 275 received, 3% packet loss, time 84911801ms
2021-05-20 00:04:31 rtt min/avg/max/mdev = 40.449/1253.724/115611.425/9112.472 ms

############## carina - 05/20/21 00:24:20 EST -0500 ##############

2021-05-21 00:05:40 284 packets transmitted, 260 received, 8% packet loss, time 84912251ms
2021-05-21 00:05:40 rtt min/avg/max/mdev = 42.205/1113.305/183966.167/11742.265 ms

############## carina - 05/21/21 00:24:20 EST -0500 ##############

2021-05-22 00:04:31 284 packets transmitted, 275 received, 3% packet loss, time 84911241ms
2021-05-22 00:04:31 rtt min/avg/max/mdev = 37.874/549.802/123798.747/7463.156 ms
